{"$schema":"https://json-schema.org/draft/2020-12/schema","$id":"https://wpessential.local/schema/product-option-contract.json","title":"WPEssential Atomic Product Option Contract","type":"object","additionalProperties":false,"required":["schema_version","surface_id","surface_key","benchmark_snapshot","status","feature_groups","coverage_summary"],"properties":{"schema_version":{"type":"integer","const":1},"surface_id":{"type":"integer","minimum":1,"maximum":56},"surface_key":{"type":"string","minLength":1},"benchmark_snapshot":{"type":"object","additionalProperties":false,"required":["date","products"],"properties":{"date":{"type":"string","format":"date"},"products":{"type":"array","minItems":1,"items":{"type":"object","additionalProperties":false,"required":["name","role","official_sources"],"properties":{"name":{"type":"string","minLength":1},"role":{"enum":["primary","secondary","specialist"]},"official_sources":{"type":"array","minItems":1,"items":{"type":"string","format":"uri"}}}}}}},"status":{"enum":["BENCHMARKING","CAPABILITY_INVENTORY_COMPLETE","ATOMIC_INVENTORY_COMPLETE","OPTION_CONTRACT_COMPLETE","UX_CONTRACT_COMPLETE","PRODUCT_PLANNED","IMPLEMENTING","RUNTIME_CERTIFIED","PRODUCT_PARITY_CERTIFIED"]},"feature_groups":{"type":"array","minItems":1,"items":{"$ref":"#/$defs/featureGroup"}},"source_projection":{"$ref":"#/$defs/sourceProjection"},"coverage_summary":{"type":"object","additionalProperties":false,"required":["atomic_options","parity","exceeds","deferred","rejected_unsafe","missing","unclassified"],"properties":{"atomic_options":{"type":"integer","minimum":0},"parity":{"type":"integer","minimum":0},"exceeds":{"type":"integer","minimum":0},"deferred":{"type":"integer","minimum":0},"rejected_unsafe":{"type":"integer","minimum":0},"missing":{"type":"integer","minimum":0},"unclassified":{"type":"integer","minimum":0}}}},"$defs":{"sourceProjection":{"type":"object","additionalProperties":false,"required":["source_type","source_surface_key","source_review_version","source_record_count","entries"],"properties":{"source_type":{"enum":["options_bank"]},"source_surface_key":{"type":"string","minLength":1},"source_review_version":{"type":"string","minLength":1},"source_record_count":{"type":"integer","minimum":0},"entries":{"type":"array","items":{"$ref":"#/$defs/sourceProjectionEntry"}}}},"sourceProjectionEntry":{"type":"object","additionalProperties":false,"required":["source_id","source_kind","disposition","atomic_ids","reason","evidence_refs"],"properties":{"source_id":{"type":"string","pattern":"^[a-z0-9][a-z0-9._-]*$"},"source_kind":{"type":"string","minLength":1},"disposition":{"enum":["AUTHORED_ATOMIC","USER_PREFERENCE_ATOMIC","INTEGRATION_ATOMIC","EFFECTIVE_OR_DIAGNOSTIC","RUNTIME_IMPLEMENTATION_EVIDENCE","OUT_OF_SURFACE_REFERENCE","COMPATIBILITY_PROVIDER_MAPPING","DEFERRED","REJECTED_UNSAFE","WPE_EXCEED"]},"atomic_ids":{"type":"array","uniqueItems":true,"items":{"type":"string","pattern":"^[a-z0-9][a-z0-9._-]*$"}},"owner_surface":{"type":["string","null"]},"reason":{"type":"string","minLength":1},"evidence_refs":{"type":"array","items":{"type":"string","minLength":1}}}},"featureGroup":{"type":"object","additionalProperties":false,"required":["id","label","options"],"properties":{"id":{"type":"string","pattern":"^[a-z0-9][a-z0-9._-]*$"},"label":{"type":"string","minLength":1},"options":{"type":"array","items":{"$ref":"#/$defs/atomicOption"}}}},"atomicOption":{"type":"object","additionalProperties":false,"required":["id","label","kind","parity_status","requiredness","value_type","default_behavior","ui","validation","storage","runtime","security","portability","testing","competitor_evidence"],"properties":{"id":{"type":"string","pattern":"^[a-z0-9][a-z0-9._-]*$"},"label":{"type":"string","minLength":1},"description":{"type":"string"},"kind":{"enum":["native_option","wpe_option","capability","workflow","integration","ux_capability","data_behavior","developer_extension"]},"native_source":{"type":["object","null"],"additionalProperties":false,"required":["api","key"],"properties":{"api":{"type":"string"},"key":{"type":"string"},"since":{"type":["string","null"]},"internal":{"type":"boolean","default":false}}},"parity_status":{"enum":["MISSING","PLANNED_BASELINE","PARITY","EXCEEDS","NOT_APPLICABLE","DEFERRED_WITH_REASON","REJECTED_UNSAFE"]},"parity_reason":{"type":"string"},"requiredness":{"enum":["required_create","required_publish","optional","computed","provider_required"]},"value_type":{"type":"string","minLength":1},"allowed_values":{"type":["array","null"],"items":{}},"default_behavior":{"type":"object","additionalProperties":false,"required":["mode"],"properties":{"mode":{"enum":["wordpress_default","inherited","wpe_default","computed","none"]},"value":{},"inherits_from":{"type":["string","null"]},"notes":{"type":"string"}}},"dependencies":{"type":"array","items":{"type":"object","additionalProperties":false,"required":["option","operator"],"properties":{"option":{"type":"string"},"operator":{"enum":["equals","not_equals","truthy","falsy","in","not_in","exists"]},"value":{},"effect":{"enum":["visible","enabled","required","warning","inapplicable"]}}}},"ui":{"type":"object","additionalProperties":false,"required":["tier","group","control"],"properties":{"tier":{"enum":["Essential","Advanced","Expert","System"]},"group":{"type":"string"},"control":{"type":"string"},"search_terms":{"type":"array","items":{"type":"string"}},"help":{"type":"string"},"danger_level":{"enum":["none","low","medium","high","critical"]},"resettable":{"type":"boolean"},"preview":{"type":["string","null"]}}},"validation":{"type":"object","additionalProperties":false,"required":["server_authoritative"],"properties":{"server_authoritative":{"const":true},"rules":{"type":"array","items":{"type":"string"}},"collision_checks":{"type":"array","items":{"type":"string"}},"sanitize":{"type":["string","null"]}}},"storage":{"type":"object","additionalProperties":false,"required":["owner","mode"],"properties":{"owner":{"type":"string"},"mode":{"type":"string"},"omit_when_default":{"type":"boolean"},"indexing":{"type":["string","null"]},"revisioned":{"type":"boolean"}}},"runtime":{"type":"object","additionalProperties":false,"required":["effect","mutation_class"],"properties":{"effect":{"type":"string"},"mutation_class":{"enum":["reversible","high_impact","migration_required","immutable","destructive","read_only"]},"side_effects":{"type":"array","items":{"type":"string"}},"performance_class":{"enum":["P0","P1","P2","P3","P4","not_applicable"]}}},"security":{"type":"object","additionalProperties":false,"required":["class","capability"],"properties":{"class":{"enum":["normal","privileged","expert","provider_only","internal","prohibited"]},"capability":{"type":["string","null"]},"policy_notes":{"type":"string"}}},"portability":{"type":"object","additionalProperties":false,"required":["export","import"],"properties":{"export":{"type":"boolean"},"import":{"type":"boolean"},"environment_sensitive":{"type":"boolean"},"secret":{"type":"boolean"},"migration_adapter":{"type":["string","null"]}}},"multisite":{"type":["object","null"],"additionalProperties":false,"properties":{"scope":{"enum":["site","network","global","user","provider_defined"]},"network_override":{"type":"boolean"},"notes":{"type":"string"}}},"testing":{"type":"object","additionalProperties":false,"required":["required_evidence"],"properties":{"required_evidence":{"type":"array","minItems":1,"items":{"enum":["unit","integration","wordpress_runtime","rest","browser","accessibility","migration","performance","security","compatibility","portability"]}},"must_not":{"type":"array","items":{"type":"string"}}}},"competitor_evidence":{"type":"array","items":{"type":"object","additionalProperties":false,"required":["product","capability","source"],"properties":{"product":{"type":"string"},"capability":{"type":"string"},"source":{"type":"string","format":"uri"},"snapshot_date":{"type":"string","format":"date"}}}},"wpe_exceed":{"type":["object","null"],"additionalProperties":false,"properties":{"reason":{"type":"string"},"depends_on":{"type":"array","items":{"type":"string"}}}}}}}}