{"schema_version":1,"surface_id":8,"surface_key":"columns","benchmark_snapshot":{"date":"2026-09-01","products":[{"name":"Admin Columns Pro","role":"primary","official_sources":["https://www.admincolumns.com/features/","https://www.admincolumns.com/export/","https://www.admincolumns.com/inline-editing/"]},{"name":"Meta Box MB Admin Columns","role":"specialist","official_sources":["https://docs.metabox.io/extensions/mb-admin-columns/"]},{"name":"JetEngine Admin Columns","role":"specialist","official_sources":["https://crocoblock.com/knowledge-base/features/admin-columns-overview/"]}]},"status":"UX_CONTRACT_COMPLETE","feature_groups":[{"id":"view.identity_scope","label":"View Identity & Scope","options":[{"id":"columns.view.definition","label":"View Definition","description":"WPE-owned revisioned view definition.","kind":"wpe_option","parity_status":"PARITY","parity_reason":"Implementation-grade contract derived from certified WordPress/native and current market evidence.","requiredness":"required_create","value_type":"object","allowed_values":null,"default_behavior":{"mode":"wpe_default","notes":"Defaults resolve server-side through the canonical Surface 8 contract."},"dependencies":[],"ui":{"tier":"Essential","group":"Definition","control":"view_definition","search_terms":["view definition","columns view definition"],"help":"WPE-owned revisioned view definition.","danger_level":"none","resettable":true,"preview":null},"validation":{"server_authoritative":true,"rules":["Validate typed values and referenced owners before mutation."],"collision_checks":["Reject duplicate stable IDs/keys within a View definition."],"sanitize":"surface8_typed_contract"},"storage":{"owner":"columns","mode":"revisioned_definition","omit_when_default":false,"indexing":null,"revisioned":true},"runtime":{"effect":"Compile Surface 8 presentation definition through canonical adapters.","mutation_class":"reversible","side_effects":[],"performance_class":"P1"},"security":{"class":"normal","capability":"edit_posts","policy_notes":"Visibility is presentation only; authorization is enforced by canonical Policy/source owners."},"portability":{"export":true,"import":true,"environment_sensitive":false,"secret":false,"migration_adapter":null},"multisite":{"scope":"site","network_override":false,"notes":"Site/user scope is resolved from trusted runtime context."},"testing":{"required_evidence":["unit","integration","compatibility"],"must_not":["MUST NOT bypass canonical source-owner validation or Policy.","MUST NOT introduce arbitrary executable PHP/JavaScript configuration."]},"competitor_evidence":[{"product":"Admin Columns Pro","capability":"View Definition","source":"https://www.admincolumns.com/features/","snapshot_date":"2026-09-01"}],"wpe_exceed":null},{"id":"columns.view.assignment","label":"View Assignment","description":"Role/user/capability assignment references; authorization stays Policy-owned.","kind":"wpe_option","parity_status":"PARITY","parity_reason":"Implementation-grade contract derived from certified WordPress/native and current market evidence.","requiredness":"optional","value_type":"object","allowed_values":null,"default_behavior":{"mode":"wpe_default","notes":"Defaults resolve server-side through the canonical Surface 8 contract."},"dependencies":[],"ui":{"tier":"Advanced","group":"Definition","control":"assignment_editor","search_terms":["view assignment","columns view assignment"],"help":"Role/user/capability assignment references; authorization stays Policy-owned.","danger_level":"none","resettable":true,"preview":null},"validation":{"server_authoritative":true,"rules":["Validate typed values and referenced owners before mutation."],"collision_checks":["Reject duplicate stable IDs/keys within a View definition."],"sanitize":"surface8_typed_contract"},"storage":{"owner":"columns","mode":"revisioned_definition","omit_when_default":false,"indexing":null,"revisioned":true},"runtime":{"effect":"Compile Surface 8 presentation definition through canonical adapters.","mutation_class":"reversible","side_effects":[],"performance_class":"P1"},"security":{"class":"normal","capability":"edit_posts","policy_notes":"Visibility is presentation only; authorization is enforced by canonical Policy/source owners."},"portability":{"export":true,"import":true,"environment_sensitive":false,"secret":false,"migration_adapter":null},"multisite":{"scope":"site","network_override":false,"notes":"Site/user scope is resolved from trusted runtime context."},"testing":{"required_evidence":["unit","integration","compatibility"],"must_not":["MUST NOT bypass canonical source-owner validation or Policy.","MUST NOT introduce arbitrary executable PHP/JavaScript configuration."]},"competitor_evidence":[{"product":"Admin Columns Pro","capability":"View Assignment","source":"https://www.admincolumns.com/features/","snapshot_date":"2026-09-01"}],"wpe_exceed":null},{"id":"columns.view.layout","label":"View Layout Policy","description":"Shared list-table layout policy.","kind":"wpe_option","parity_status":"PARITY","parity_reason":"Implementation-grade contract derived from certified WordPress/native and current market evidence.","requiredness":"optional","value_type":"object","allowed_values":null,"default_behavior":{"mode":"wpe_default","notes":"Defaults resolve server-side through the canonical Surface 8 contract."},"dependencies":[],"ui":{"tier":"Advanced","group":"Layout","control":"layout_editor","search_terms":["view layout policy","columns view layout"],"help":"Shared list-table layout policy.","danger_level":"none","resettable":true,"preview":null},"validation":{"server_authoritative":true,"rules":["Validate typed values and referenced owners before mutation."],"collision_checks":["Reject duplicate stable IDs/keys within a View definition."],"sanitize":"surface8_typed_contract"},"storage":{"owner":"columns","mode":"revisioned_definition","omit_when_default":false,"indexing":null,"revisioned":true},"runtime":{"effect":"Compile Surface 8 presentation definition through canonical adapters.","mutation_class":"reversible","side_effects":[],"performance_class":"P1"},"security":{"class":"normal","capability":"edit_posts","policy_notes":"Visibility is presentation only; authorization is enforced by canonical Policy/source owners."},"portability":{"export":true,"import":true,"environment_sensitive":false,"secret":false,"migration_adapter":null},"multisite":{"scope":"site","network_override":false,"notes":"Site/user scope is resolved from trusted runtime context."},"testing":{"required_evidence":["unit","integration","compatibility","browser","accessibility"],"must_not":["MUST NOT bypass canonical source-owner validation or Policy.","MUST NOT introduce arbitrary executable PHP/JavaScript configuration."]},"competitor_evidence":[{"product":"Admin Columns Pro","capability":"View Layout Policy","source":"https://www.admincolumns.com/features/","snapshot_date":"2026-09-01"}],"wpe_exceed":null},{"id":"columns.preference.runtime","label":"Personal Runtime Preferences","description":"User-scoped chosen view, temporary sort/filter, visibility and density.","kind":"native_option","parity_status":"PARITY","parity_reason":"Implementation-grade contract derived from certified WordPress/native and current market evidence.","requiredness":"optional","value_type":"object","allowed_values":null,"default_behavior":{"mode":"wpe_default","notes":"Defaults resolve server-side through the canonical Surface 8 contract."},"dependencies":[],"ui":{"tier":"Essential","group":"Preferences","control":"preference_panel","search_terms":["personal runtime preferences","columns preference runtime"],"help":"User-scoped chosen view, temporary sort/filter, visibility and density.","danger_level":"none","resettable":true,"preview":null},"validation":{"server_authoritative":true,"rules":["Validate typed values and referenced owners before mutation."],"collision_checks":["Reject duplicate stable IDs/keys within a View definition."],"sanitize":"surface8_typed_contract"},"storage":{"owner":"columns","mode":"user_preference","omit_when_default":false,"indexing":null,"revisioned":false},"runtime":{"effect":"Compile Surface 8 presentation definition through canonical adapters.","mutation_class":"reversible","side_effects":[],"performance_class":"P1"},"security":{"class":"normal","capability":"edit_posts","policy_notes":"Visibility is presentation only; authorization is enforced by canonical Policy/source owners."},"portability":{"export":false,"import":false,"environment_sensitive":false,"secret":false,"migration_adapter":null},"multisite":{"scope":"user","network_override":false,"notes":"Site/user scope is resolved from trusted runtime context."},"testing":{"required_evidence":["unit","integration","compatibility"],"must_not":["MUST NOT bypass canonical source-owner validation or Policy.","MUST NOT introduce arbitrary executable PHP/JavaScript configuration."]},"competitor_evidence":[{"product":"Admin Columns Pro","capability":"Personal Runtime Preferences","source":"https://www.admincolumns.com/features/","snapshot_date":"2026-09-01"}],"wpe_exceed":null},{"id":"columns.target.adapter","label":"Target Adapter","description":"Typed list-table target adapter selection.","kind":"integration","parity_status":"PARITY","parity_reason":"Implementation-grade contract derived from certified WordPress/native and current market evidence.","requiredness":"required_create","value_type":"string","allowed_values":null,"default_behavior":{"mode":"wpe_default","notes":"Defaults resolve server-side through the canonical Surface 8 contract."},"dependencies":[],"ui":{"tier":"Essential","group":"Target","control":"adapter_selector","search_terms":["target adapter","columns target adapter"],"help":"Typed list-table target adapter selection.","danger_level":"none","resettable":true,"preview":null},"validation":{"server_authoritative":true,"rules":["Validate typed values and referenced owners before mutation."],"collision_checks"